<!-- 
 * Licensed to The Apereo Foundation under one or more contributor license
 * agreements. See the NOTICE file distributed with this work for
 * additional information regarding copyright ownership.
 *
 * The Apereo Foundation licenses this file to you under the Apache License,
 * Version 2.0 (the "License"); you may not use this file except in
 * compliance with the License. You may obtain a copy of the License at:
 *
 * http://www.apache.org/licenses/LICENSE-2.0
 *
 * Unless required by applicable law or agreed to in writing, software
 * distributed under the License is distributed on an "AS IS" BASIS,
 * WITHOUT WARRANTIES OR CONDITIONS OF ANY KIND, either express or implied.
 *
 * See the License for the specific language governing permissions and
 * limitations under the License.
 * 
 -->

<!ELEMENT release-history (doc-title,release+)>

<!ELEMENT doc-title (#PCDATA)>

<!ELEMENT release (version,release-date,category+)>
<!ELEMENT version (#PCDATA)>
<!ELEMENT release-date (#PCDATA)>

<!ELEMENT category (title,item+)>
<!ELEMENT title (#PCDATA)>

<!ELEMENT item (name,description)>
<!ELEMENT name (#PCDATA)>

<!ELEMENT description (line+)>
<!ELEMENT line (#PCDATA|line)*>